{"$schema":"https://json-schema.org/draft/2020-12/schema","$id":"kalshi_operator_signoff_contract.schema.json","title":"KalshiOperatorSignoffContract","description":"Phase 5E — Operator signoff contract. Manual review required. No signoff complete. No approval token.","type":"object","additionalProperties":false,"required":["kalshi_operator_signoff_contract_id","schema_version","generated_at","phase","signoff_status","upstream_gate_evaluation_summary_id","upstream_summary_schema_version","operator_signoff_complete","manual_review_required","operator_review_required","safety_flags","forbidden_capabilities","allowed_outputs","forbidden_outputs","reason_code","reason"],"properties":{"kalshi_operator_signoff_contract_id":{"type":"string","pattern":"^kosc_[a-f0-9]{32}$"},"schema_version":{"const":"kalshi_operator_signoff_contract.v1"},"generated_at":{"type":"string","format":"date-time"},"phase":{"const":"Phase 5E"},"signoff_status":{"enum":["not_complete","awaiting_review","blocked"]},"upstream_gate_evaluation_summary_id":{"type":"string","pattern":"^kges_[a-f0-9]{32}$"},"upstream_summary_schema_version":{"const":"kalshi_gate_evaluation_summary.v1"},"operator_signoff_complete":{"const":false},"manual_review_required":{"const":true},"operator_review_required":{"const":true},"safety_flags":{"type":"object","additionalProperties":false,"required":["paper_only","phase_6_ready","live_mode_allowed","order_placement_allowed","credentials_allowed","autonomous_execution_allowed","operator_signoff_complete"],"properties":{"paper_only":{"const":true},"phase_6_ready":{"const":false},"live_mode_allowed":{"const":false},"order_placement_allowed":{"const":false},"credentials_allowed":{"const":false},"autonomous_execution_allowed":{"const":false},"operator_signoff_complete":{"const":false}}},"forbidden_capabilities":{"type":"array","items":{"type":"string"},"minItems":1},"allowed_outputs":{"type":"array","items":{"type":"string"},"minItems":1},"forbidden_outputs":{"type":"array","items":{"type":"string"},"minItems":1},"reason_code":{"const":"OPERATOR_SIGNOFF_NOT_COMPLETE"},"reason":{"type":"string","minLength":1}}}
